<?xml version="1.0"?>
<!DOCTYPE consequences SYSTEM "consequences.dtd">

<consequences>
  <user id="unique01234" name="simondo" email="simon@bluestone.co.uk"/>
  <drawing>
    <bodypart part="head">
      <line>
        <point x="100" y="200"/>
        <point x="245" y="423"/>
        <point x="234" y="543"/>
        <point x="431" y="343"/>
      </line>
    </bodypart>
    <send_on_to email="bodger@badger.com"/>
  </drawing>
</consequences>